id,chapterNo,chapterTitle,unitNo,unitTitle,wordNo,originalWord,word,translation,partOfSpeech,example,translationSource,exampleSource,qaFlags,source,note
1545,18,Measurement,100,Quantities,8,dozen,dozen,十幾個,,This lesson uses the word dozen in the unit Quantities.,machine_translation,generated_example,,OCR from scanned page,* 8 dozen (n)O Would you pleas
1546,18,Measurement,100,Quantities,9,piece,piece,一塊,,This lesson uses the word piece in the unit Quantities.,machine_translation,generated_example,,OCR from scanned page,| * 9 piece (n)O Would you like a
1547,18,Measurement,100,Quantities,10,sheet,sheet,片材,,This lesson uses the word sheet in the unit Quantities.,machine_translation,generated_example,duplicate_word,OCR from scanned page,10 sheet (n.) Can you fold a sh
1548,18,Measurement,100,Quantities,11,loaf,loaf,麵包,,This lesson uses the word loaf in the unit Quantities.,machine_translation,generated_example,,OCR from scanned page,© loaf(n.o A fresh loaf of br
1549,18,Measurement,100,Quantities,12,pile,pile,堆疊,,This lesson uses the word pile in the unit Quantities.,machine_translation,generated_example,,OCR from scanned page,#72 pile (x) Please wash that
1550,18,Measurement,100,Quantities,13,bundle,bundle,束,,This lesson uses the word bundle in the unit Quantities.,machine_translation,generated_example,,OCR from scanned page,"14 bundle (n.), Go get another b"
1551,18,Measurement,100,Quantities,14,group,group,群組,,This lesson uses the word group in the unit Quantities.,machine_translation,generated_example,,OCR from scanned page,*15 group (n)© The group of nev
1552,18,Measurement,100,Quantities,15,crowd,crowd,人群,,This lesson uses the word crowd in the unit Quantities.,machine_translation,generated_example,,OCR from scanned page,16 crowd (n.) There was a large
1553,18,Measurement,100,Quantities,16,T mass,T mass,T品質,,This lesson uses the word T mass in the unit Quantities.,machine_translation,generated_example,,OCR from scanned page,©1T mass (x) O There is usually a
1554,19,Festivals and Culture,101,Chinese vs. Western,1,festival,festival,節慶,,This lesson uses the word festival in the unit Chinese vs. Western.,machine_translation,generated_example,,Manual correction from page image,manual correction from page image / OCR
1555,19,Festivals and Culture,101,Chinese vs. Western,2,holiday,holiday,假期,,This lesson uses the word holiday in the unit Chinese vs. Western.,machine_translation,generated_example,duplicate_word,Manual correction from page image,manual correction from page image / OCR
1556,19,Festivals and Culture,101,Chinese vs. Western,3,vacation,vacation,假期,,This lesson uses the word vacation in the unit Chinese vs. Western.,machine_translation,generated_example,,Manual correction from page image,manual correction from page image / OCR
1557,19,Festivals and Culture,101,Chinese vs. Western,4,Chinese New Year,Chinese New Year,中國新年,,This lesson uses the word Chinese New Year in the unit Chinese vs. Western.,machine_translation,generated_example,,Manual correction from page image,manual correction from page image / OCR
1558,19,Festivals and Culture,101,Chinese vs. Western,5,Dragon-boat Festival,Dragon-boat Festival,端午節,,This lesson uses the word Dragon-boat Festival in the unit Chinese vs. Western.,machine_translation,generated_example,,Manual correction from page image,manual correction from page image / OCR
1559,19,Festivals and Culture,101,Chinese vs. Western,6,New Year's Eve,New Year's Eve,除夕夜,,This lesson uses the word New Year's Eve in the unit Chinese vs. Western.,machine_translation,generated_example,,Manual correction from page image,manual correction from page image / OCR
1560,19,Festivals and Culture,101,Chinese vs. Western,7,Lantern Festival,Lantern Festival,元宵節,,This lesson uses the word Lantern Festival in the unit Chinese vs. Western.,machine_translation,generated_example,,Manual correction from page image,manual correction from page image / OCR
1561,19,Festivals and Culture,101,Chinese vs. Western,8,lantern,lantern,燈籠,,This lesson uses the word lantern in the unit Chinese vs. Western.,machine_translation,generated_example,,Manual correction from page image,manual correction from page image / OCR
1562,19,Festivals and Culture,101,Chinese vs. Western,9,Moon Festival,Moon Festival,中秋節,,This lesson uses the word Moon Festival in the unit Chinese vs. Western.,machine_translation,generated_example,,Manual correction from page image,manual correction from page image / OCR
1563,19,Festivals and Culture,101,Chinese vs. Western,10,Double Tenth Day,Double Tenth Day,雙十日,,This lesson uses the word Double Tenth Day in the unit Chinese vs. Western.,machine_translation,generated_example,,Manual correction from page image,manual correction from page image / OCR
1564,19,Festivals and Culture,101,Chinese vs. Western,11,Teacher's Day,Teacher's Day,教師節,,This lesson uses the word Teacher's Day in the unit Chinese vs. Western.,machine_translation,generated_example,,Manual correction from page image,manual correction from page image / OCR
1565,19,Festivals and Culture,101,Chinese vs. Western,12,Christmas,Christmas,聖誕節,,This lesson uses the word Christmas in the unit Chinese vs. Western.,machine_translation,generated_example,,Manual correction from page image,manual correction from page image / OCR
1566,19,Festivals and Culture,101,Chinese vs. Western,13,New Year's Day,New Year's Day,元旦,,This lesson uses the word New Year's Day in the unit Chinese vs. Western.,machine_translation,generated_example,,Manual correction from page image,manual correction from page image / OCR
1567,19,Festivals and Culture,101,Chinese vs. Western,14,Thanksgiving,Thanksgiving,感恩節,,This lesson uses the word Thanksgiving in the unit Chinese vs. Western.,machine_translation,generated_example,,Manual correction from page image,manual correction from page image / OCR
1568,19,Festivals and Culture,101,Chinese vs. Western,15,Valentine's Day,Valentine's Day,情人節,,This lesson uses the word Valentine's Day in the unit Chinese vs. Western.,machine_translation,generated_example,,Manual correction from page image,manual correction from page image / OCR
1569,19,Festivals and Culture,101,Chinese vs. Western,16,valentine,valentine,情人節,,This lesson uses the word valentine in the unit Chinese vs. Western.,machine_translation,generated_example,,Manual correction from page image,manual correction from page image / OCR
1570,19,Festivals and Culture,101,Chinese vs. Western,17,Easter,Easter,復活節,,This lesson uses the word Easter in the unit Chinese vs. Western.,machine_translation,generated_example,,Manual correction from page image,manual correction from page image / OCR
1571,19,Festivals and Culture,101,Chinese vs. Western,18,Mother's Day,Mother's Day,母親節,,This lesson uses the word Mother's Day in the unit Chinese vs. Western.,machine_translation,generated_example,,Manual correction from page image,manual correction from page image / OCR
1572,19,Festivals and Culture,101,Chinese vs. Western,19,Father's Day,Father's Day,父親節,,This lesson uses the word Father's Day in the unit Chinese vs. Western.,machine_translation,generated_example,,Manual correction from page image,manual correction from page image / OCR
1573,19,Festivals and Culture,102,Halloween,1,spirit,spirit,精神,,This lesson uses the word spirit in the unit Halloween.,machine_translation,generated_example,,OCR from scanned page,© 2 spirit (1) O Scary movies are often about evil sp
1574,19,Festivals and Culture,102,Halloween,2,soul,soul,靈魂,,This lesson uses the word soul in the unit Halloween.,machine_translation,generated_example,,OCR from scanned page,© 3 soul(n@ The man's face is
1575,19,Festivals and Culture,102,Halloween,3,activity,activity,活動,,This lesson uses the word activity in the unit Halloween.,machine_translation,generated_example,,OCR from scanned page,© 4 activity (a) Teenagers don't
1576,19,Festivals and Culture,102,Halloween,4,design,design,設計,,This lesson uses the word design in the unit Halloween.,machine_translation,generated_example,,OCR from scanned page,© 6 design () want to design
1577,19,Festivals and Culture,102,Halloween,5,hang,hang,掛,,This lesson uses the word hang in the unit Halloween.,machine_translation,generated_example,,OCR from scanned page,* 7 hang (v) Some lanterns we
1578,19,Festivals and Culture,102,Halloween,6,trick,trick,伎倆,,This lesson uses the word trick in the unit Halloween.,machine_translation,generated_example,,OCR from scanned page,* 8 trick (nO The kids like to p
1579,19,Festivals and Culture,102,Halloween,7,mask,mask,口罩,n.[C],Wear a mask so you won't give your cold to others.,source_771,source_771,duplicate_word,OCR from scanned page,*9 mask (nO Todd plans to we
1580,19,Festivals and Culture,102,Halloween,8,pick,pick,挑選,,This lesson uses the word pick in the unit Halloween.,machine_translation,generated_example,,OCR from scanned page,10 pick (%) You can pick one
1581,19,Festivals and Culture,102,Halloween,9,frighten,frighten,嚇唬,,This lesson uses the word frighten in the unit Halloween.,machine_translation,generated_example,,OCR from scanned page,© 01 frighten (w) The little boy is ft
1582,19,Festivals and Culture,102,Halloween,10,surprise,surprise,驚喜,,This lesson uses the word surprise in the unit Halloween.,machine_translation,generated_example,,OCR from scanned page,* 12 surprise (x) (n.) Jimmy's costume
1583,19,Festivals and Culture,102,Halloween,11,neighbor,neighbor,鄰居,,This lesson uses the word neighbor in the unit Halloween.,machine_translation,generated_example,,OCR from scanned page,"*13 neighbor (n)@ On Halloween, yc"
1584,19,Festivals and Culture,102,Halloween,12,join,join,加入,,This lesson uses the word join in the unit Halloween.,machine_translation,generated_example,,OCR from scanned page,¥ 14 join (w) Emma joined her
1585,19,Festivals and Culture,103,Have a Party,1,arrange,arrange,安排,,This lesson uses the word arrange in the unit Have a Party.,machine_translation,generated_example,,OCR from scanned page,| 1 arrange (w) Please arrange the chairs in three r
1586,19,Festivals and Culture,103,Have a Party,2,special,special,特別的,,This lesson uses the word special in the unit Have a Party.,machine_translation,generated_example,,OCR from scanned page,* 2 special (a) ‘Adam's Halloween party was really
1587,19,Festivals and Culture,103,Have a Party,3,unique,unique,獨特的,,This lesson uses the word unique in the unit Have a Party.,machine_translation,generated_example,,OCR from scanned page,© 4 unique (a) The host wante
1588,19,Festivals and Culture,103,Have a Party,4,have,have,有,,This lesson uses the word have in the unit Have a Party.,machine_translation,generated_example,duplicate_word,OCR from scanned page,*5 have (x) We have an apy
1589,19,Festivals and Culture,103,Have a Party,5,party,party,聚會,,This lesson uses the word party in the unit Have a Party.,machine_translation,generated_example,,OCR from scanned page,* 6 party (n.) What are you g
1590,19,Festivals and Culture,103,Have a Party,6,birthday,birthday,生日,,This lesson uses the word birthday in the unit Have a Party.,machine_translation,generated_example,,OCR from scanned page,*7 birthday(a)Q Vick will do mac
1591,19,Festivals and Culture,103,Have a Party,7,wedding,wedding,婚禮,n.[C],The couple became husband and wife at their beautifulwedding.,source_771,source_771,,OCR from scanned page,© 8 wedding (n)© | still remember
1592,19,Festivals and Culture,103,Have a Party,8,memory,memory,記憶,,This lesson uses the word memory in the unit Have a Party.,machine_translation,generated_example,,OCR from scanned page,10 memory (n.) The friends mad
1593,19,Festivals and Culture,103,Have a Party,9,barbecue,barbecue,燒烤,,This lesson uses the word barbecue in the unit Have a Party.,machine_translation,generated_example,,OCR from scanned page,13 barbecue (n) We are going to
1594,19,Festivals and Culture,103,Have a Party,10,guest,guest,客人,,This lesson uses the word guest in the unit Have a Party.,machine_translation,generated_example,,OCR from scanned page,14 guest (g0x1} (n.)© — How many guest
1595,19,Festivals and Culture,103,Have a Party,11,invitation,invitation,邀請函,,This lesson uses the word invitation in the unit Have a Party.,machine_translation,generated_example,,OCR from scanned page,© 16 invitation (n)@ Did you get the |
1596,19,Festivals and Culture,103,Have a Party,12,visitor,visitor,訪客,,This lesson uses the word visitor in the unit Have a Party.,machine_translation,generated_example,,OCR from scanned page,¥* 18 visitor (1) 0 The visitors from
1597,20,Weather and Nature,104,Weather 1,1,weather,weather,天氣,,The word weather helps us talk about nature.,machine_translation,generated_example,,OCR from scanned page,"* 1 weather (n.)@ If the weather is sunny, we can go"
1598,20,Weather and Nature,104,Weather 1,2,sunny,sunny,陽光明媚,,The word sunny helps us talk about nature.,machine_translation,generated_example,,OCR from scanned page,| * 2 sunny (sant (2) weatherman SR48BA i weather fo
1599,20,Weather and Nature,104,Weather 1,3,rainy,rainy,下雨的,,The word rainy helps us talk about nature.,machine_translation,generated_example,,OCR from scanned page,* 4 rainy (a) This is a rainy c
1600,20,Weather and Nature,104,Weather 1,4,rain,rain,雨,,The word rain helps us talk about nature.,machine_translation,generated_example,,OCR from scanned page,*5 rain(n) «Oo We don't have 1
1601,20,Weather and Nature,104,Weather 1,5,shower,shower,淋浴,,The word shower helps us talk about nature.,machine_translation,generated_example,,OCR from scanned page,"*® 6 shower (n.)@ It's not stormy, |"
1602,20,Weather and Nature,104,Weather 1,6,snowy,snowy,下雪的,,The word snowy helps us talk about nature.,machine_translation,generated_example,,OCR from scanned page,* 9 snowy (a) Always be carefi
1603,20,Weather and Nature,104,Weather 1,7,snow,snow,雪,,The word snow helps us talk about nature.,machine_translation,generated_example,,OCR from scanned page,*10snow(n.)(x)@] We have to clea
1604,20,Weather and Nature,104,Weather 1,8,windy,windy,有風的,,The word windy helps us talk about nature.,machine_translation,generated_example,,OCR from scanned page,"* 11 windy (a) It’s windy, so yo"
1605,20,Weather and Nature,104,Weather 1,9,wind,wind,風,,The word wind helps us talk about nature.,machine_translation,generated_example,,OCR from scanned page,12 wind (x) The wind blows
1606,20,Weather and Nature,104,Weather 1,10,blow,blow,吹,,The word blow helps us talk about nature.,machine_translation,generated_example,,OCR from scanned page,13 blow () GHB blow out cand
1607,20,Weather and Nature,104,Weather 1,11,foggy,foggy,有霧的,,The word foggy helps us talk about nature.,machine_translation,generated_example,,OCR from scanned page,14 foggy (a) The sky looks fo
1608,20,Weather and Nature,104,Weather 1,12,fog,fog,霧,,The word fog helps us talk about nature.,machine_translation,generated_example,,OCR from scanned page,15 fog (nO We hiked throug
1609,20,Weather and Nature,104,Weather 1,13,sky,sky,天空,,The word sky helps us talk about nature.,machine_translation,generated_example,,OCR from scanned page,16 sky (kar) (JOO The sky is blue a
1610,20,Weather and Nature,104,Weather 1,14,dark,dark,黑暗,,The word dark helps us talk about nature.,machine_translation,generated_example,,OCR from scanned page,18 dark (dork) (2) The dark cold ni
1611,20,Weather and Nature,104,Weather 1,15,bright,bright,明亮,,The word bright helps us talk about nature.,machine_translation,generated_example,,OCR from scanned page,#19 bright (a) PRO
1612,20,Weather and Nature,105,Weather 2,1,temperature,temperature,溫度,,The word temperature helps us talk about nature.,machine_translation,generated_example,,OCR from scanned page,| @ 1 temperature (a) The temperature gets really cold in
1613,20,Weather and Nature,105,Weather 2,2,hot,hot,熱的,a.,It is really hot today.,source_771,source_771,duplicate_word,OCR from scanned page,* 2 hot (a) Itis really hot today. SAREE»
1614,20,Weather and Nature,105,Weather 2,3,warm,warm,溫暖,,The word warm helps us talk about nature.,machine_translation,generated_example,,OCR from scanned page,* 4 warm (a) Itis very warm tod.
1615,20,Weather and Nature,105,Weather 2,4,cool,cool,冷卻,v.,The word cool helps us talk about nature.,source_771,generated_example,duplicate_word,OCR from scanned page,* 5 cool (a) I like the cool weat!
1616,20,Weather and Nature,105,Weather 2,5,ee MV,ee MV,MV,,The word ee MV helps us talk about nature.,machine_translation,generated_example,,OCR from scanned page,see MV (Bs
1617,20,Weather and Nature,105,Weather 2,6,humid,humid,潮濕,,The word humid helps us talk about nature.,machine_translation,generated_example,,OCR from scanned page,© 7 humid (a) Taiwan has a very h
1618,20,Weather and Nature,105,Weather 2,7,climate,climate,氣候,,The word climate helps us talk about nature.,machine_translation,generated_example,,OCR from scanned page,@ 8 climate (n) BB humidity ia
1619,20,Weather and Nature,105,Weather 2,8,wet,wet,濕的,,The word wet helps us talk about nature.,machine_translation,generated_example,,OCR from scanned page,"10 wet (a.) It rained last night,"
1620,20,Weather and Nature,105,Weather 2,9,typhoon,typhoon,颱風,,The word typhoon helps us talk about nature.,machine_translation,generated_example,,OCR from scanned page,"#13 typhoon (n,) There will be a typk"
1621,20,Weather and Nature,105,Weather 2,10,rainbow,rainbow,彩虹,,The word rainbow helps us talk about nature.,machine_translation,generated_example,,OCR from scanned page,14 rainbow (n.) There was a rainbo
1622,20,Weather and Nature,105,Weather 2,11,lightning,lightning,閃電,,The word lightning helps us talk about nature.,machine_translation,generated_example,,OCR from scanned page,15 lightning (.)@ Did you see that br
1623,20,Weather and Nature,105,Weather 2,12,thunder,thunder,雷聲,,The word thunder helps us talk about nature.,machine_translation,generated_example,,OCR from scanned page,16 thunder (n) © These dogs are afre
1624,20,Weather and Nature,106,Earth and the Universe,1,universe,universe,宇宙,,The word universe helps us talk about nature.,machine_translation,generated_example,,OCR from scanned page,© 1 universe (o)@ The universe holds everything that ¢
1625,20,Weather and Nature,106,Earth and the Universe,2,space,space,空間,,The word space helps us talk about nature.,machine_translation,generated_example,,OCR from scanned page,* 2 space (n) OO Mark wishes to go into outer space
1626,20,Weather and Nature,106,Earth and the Universe,3,earth,earth,地球,,The word earth helps us talk about nature.,machine_translation,generated_example,,OCR from scanned page,3 earth (0) 90 Earth looks beautiful from outer sp
1627,20,Weather and Nature,106,Earth and the Universe,4,earthquake,earthquake,地震,,The word earthquake helps us talk about nature.,machine_translation,generated_example,,OCR from scanned page,* 4 earthquake (n.)® The 921 earthquak
1628,20,Weather and Nature,106,Earth and the Universe,5,planet,planet,行星,,The word planet helps us talk about nature.,machine_translation,generated_example,,OCR from scanned page,*5 planet (1) © We live on the plan
1629,20,Weather and Nature,106,Earth and the Universe,6,rise,rise,上升,,The word rise helps us talk about nature.,machine_translation,generated_example,,OCR from scanned page,* 7 rise (v) The sun rises every
1630,20,Weather and Nature,106,Earth and the Universe,7,moon,moon,月亮,,The word moon helps us talk about nature.,machine_translation,generated_example,,OCR from scanned page,* 8 moon (n.)@) Kevin wants to go t
1631,20,Weather and Nature,106,Earth and the Universe,8,star,star,明星,,The word star helps us talk about nature.,machine_translation,generated_example,,OCR from scanned page,* 9 star(n)© There are many stat
1632,20,Weather and Nature,106,Earth and the Universe,9,air,air,空氣,,The word air helps us talk about nature.,machine_translation,generated_example,,OCR from scanned page,#0 air (a) 0 Let's open the wind
1633,20,Weather and Nature,106,Earth and the Universe,10,rock,rock,搖滾,,The word rock helps us talk about nature.,machine_translation,generated_example,duplicate_word,OCR from scanned page,#1 rock (OO The naughty kids ar
1634,20,Weather and Nature,106,Earth and the Universe,11,stone,stone,石頭,,The word stone helps us talk about nature.,machine_translation,generated_example,,OCR from scanned page,12 stone (.) Look at the colorful
1635,20,Weather and Nature,106,Earth and the Universe,12,sand,sand,沙子,,The word sand helps us talk about nature.,machine_translation,generated_example,,OCR from scanned page,13 sand (n.) Sarah likes to play ir
1636,20,Weather and Nature,106,Earth and the Universe,13,mud,mud,土,,The word mud helps us talk about nature.,machine_translation,generated_example,,OCR from scanned page,#14 mud (0) 0 Be careful not to ste
1637,20,Weather and Nature,106,Earth and the Universe,14,worm,worm,蠕蟲,,The word worm helps us talk about nature.,machine_translation,generated_example,,OCR from scanned page,15 worm (n.)[wsm]@ Worms live in the e
1638,20,Weather and Nature,106,Earth and the Universe,15,fire,fire,火,,The word fire helps us talk about nature.,machine_translation,generated_example,,OCR from scanned page,16 fire (2) 00 We sat by the fire. 3
1639,20,Weather and Nature,107,Nature 1,1,nature,nature,自然,,The word nature helps us talk about nature.,machine_translation,generated_example,,OCR from scanned page,| #1 nature()o The artist enjoys p
1640,20,Weather and Nature,107,Nature 1,2,natural,natural,自然的,,The word natural helps us talk about nature.,machine_translation,generated_example,,OCR from scanned page,2 natural (2) The natural beaut
1641,20,Weather and Nature,107,Nature 1,3,ocean,ocean,海洋,,The word ocean helps us talk about nature.,machine_translation,generated_example,,OCR from scanned page,3 ocean(n.)@G The oceanis full o
1642,20,Weather and Nature,107,Nature 1,4,sea,sea,海,,The word sea helps us talk about nature.,machine_translation,generated_example,,OCR from scanned page,* 4 sea(n) OO ‘We are going to sa
1643,20,Weather and Nature,107,Nature 1,5,lake,lake,湖,,The word lake helps us talk about nature.,machine_translation,generated_example,,OCR from scanned page,*5 lake (lek) (n)© There is a boat by:
1644,20,Weather and Nature,107,Nature 1,6,river,river,河,,The word river helps us talk about nature.,machine_translation,generated_example,,OCR from scanned page,*® 6 river (JO Eddie goes fishing
1645,20,Weather and Nature,107,Nature 1,7,bank,bank,銀行,,The word bank helps us talk about nature.,machine_translation,generated_example,duplicate_word,OCR from scanned page,*7 bank(JO Watch out for brok
1646,20,Weather and Nature,107,Nature 1,8,stream,stream,流,,The word stream helps us talk about nature.,machine_translation,generated_example,,OCR from scanned page,© 8 stream (a) This is where the sr
1647,20,Weather and Nature,107,Nature 1,9,pond,pond,池塘,,The word pond helps us talk about nature.,machine_translation,generated_example,,OCR from scanned page,"*9 pond (nq Frogs, fish, and duc"
1648,20,Weather and Nature,107,Nature 1,10,spring,spring,春天,n.[C][U],Spring is my favorite season.,source_771,source_771,duplicate_word,OCR from scanned page,*10 spring (x) © | like to relax at the
1649,20,Weather and Nature,107,Nature 1,11,waterfall,waterfall,瀑布,,The word waterfall helps us talk about nature.,machine_translation,generated_example,,OCR from scanned page,© 1 waterfall (n.) We hiked up the riv
1650,20,Weather and Nature,107,Nature 1,12,steam,steam,煮,v.,Steaming vegetables is a very healthy way to cook.,source_771,source_771,duplicate_word,OCR from scanned page,2 steam (n.)(x)@ There is steam whi
1651,20,Weather and Nature,107,Nature 1,13,allow,allow,允許,,The word allow helps us talk about nature.,machine_translation,generated_example,,OCR from scanned page,#13 allow (x) Our government d
1652,20,Weather and Nature,108,Nature 2,1,land,land,土地,,The word land helps us talk about nature.,machine_translation,generated_example,,Manual correction from page image,manual correction from page image / OCR
1653,20,Weather and Nature,108,Nature 2,2,area,area,面積,,The word area helps us talk about nature.,machine_translation,generated_example,,Manual correction from page image,manual correction from page image / OCR
1654,20,Weather and Nature,108,Nature 2,3,coast,coast,海岸,,The word coast helps us talk about nature.,machine_translation,generated_example,,Manual correction from page image,manual correction from page image / OCR
1655,20,Weather and Nature,108,Nature 2,4,beach,beach,海灘,,The word beach helps us talk about nature.,machine_translation,generated_example,,Manual correction from page image,manual correction from page image / OCR
1656,20,Weather and Nature,108,Nature 2,5,shore,shore,岸邊,,The word shore helps us talk about nature.,machine_translation,generated_example,,Manual correction from page image,manual correction from page image / OCR
1657,20,Weather and Nature,108,Nature 2,6,island,island,島,,The word island helps us talk about nature.,machine_translation,generated_example,,Manual correction from page image,manual correction from page image / OCR
1658,20,Weather and Nature,108,Nature 2,7,plain,plain,普通的,,The word plain helps us talk about nature.,machine_translation,generated_example,duplicate_word,Manual correction from page image,manual correction from page image / OCR
