id,chapterNo,chapterTitle,unitNo,unitTitle,wordNo,originalWord,word,translation,partOfSpeech,example,translationSource,exampleSource,qaFlags,source,note
0541,7,Time,34,"Past, Present, and Future",5,moment,moment,片刻,n.[C][U],Just a moment.I will be right back.,source_771,source_771,,PDF text layer,moment (n.)00
0542,7,Time,34,"Past, Present, and Future",6,past,past,過去的,a.,David has worked very hard for the past few years.,source_771,source_771,duplicate_word,PDF text layer,f 6 past (a.)
0543,7,Time,34,"Past, Present, and Future",7,former,former,之前的,a.,Our former high school science teacher just passed away.,source_771,source_771,,PDF text layer,7 former
0544,7,Time,34,"Past, Present, and Future",8,ancient,ancient,古代的,a.,"In ancient times, there was a city here.",source_771,source_771,,PDF text layer,e 9 ancient (a.)
0545,7,Time,34,"Past, Present, and Future",9,tonight,tonight,今晚,,Would you please have dinner with me tonight?,source_771,source_771,,PDF text layer,tonight (adv.)
0546,7,Time,34,"Past, Present, and Future",10,soon,soon,很快；不久,,Is Betty coming soon?,source_771,source_771,,PDF text layer,soon
0547,7,Time,34,"Past, Present, and Future",11,period,period,期間,n.[C],There will be no Internet service during this period of time.,source_771,source_771,,PDF text layer,'12 period (n.)O
0548,7,Time,34,"Past, Present, and Future",12,next,next,下一個,a.,What is the next question?,source_771,source_771,,PDF text layer,next (a.)
0549,7,Time,34,"Past, Present, and Future",13,future,future,未來,n.[U],Donna wants to be a singer in the future.,source_771,source_771,,PDF text layer,future (n.) o
0550,7,Time,34,"Past, Present, and Future",14,iater,iater,伊阿特,,"This lesson uses the word iater in the unit Past, Present, and Future.",machine_translation,generated_example,,PDF text layer,iater (a.)
0551,7,Time,34,"Past, Present, and Future",15,latter,latter,後面的,a.,Their latest video game will be out in the latter part of the month.,source_771,source_771,,PDF text layer,'16 latter
0552,7,Time,35,Telling the Time,1,type,type,類型,,This lesson uses the word type in the unit Telling the Time.,machine_translation,generated_example,duplicate_word,PDF text layer,type
0553,7,Time,35,Telling the Time,2,clock,clock,鐘,n.[C],The clock is broken.,source_771,source_771,,PDF text layer,* I clock (n.)o
0554,7,Time,35,Telling the Time,3,second,second,第二,n.a.,This lesson uses the word second in the unit Telling the Time.,source_771,generated_example,duplicate_word,PDF text layer,2 second (n.)o
0555,7,Time,35,Telling the Time,4,minute,minute,分鐘,n.[C],There are 60 minutes in an hour.,source_771,source_771,,PDF text layer,minute (n.)o
0556,7,Time,35,Telling the Time,5,hour,hour,小時,n.[C],There are 24 hours in a day.,source_771,source_771,,PDF text layer,hour (n.)o
0557,7,Time,35,Telling the Time,6,quarter,quarter,一刻,n.[C],Right now it is a quarter past three.,source_771,source_771,duplicate_word,PDF text layer,* 5 quarter (n.)o
0558,7,Time,35,Telling the Time,7,past,past,過去的,a.,David has worked very hard for the past few years.,source_771,source_771,duplicate_word,PDF text layer,6 past (prep.)
0559,7,Time,35,Telling the Time,8,instant,instant,即時,a.,You can send me an instant message at any time.,source_771,source_771,,PDF text layer,7 instant (a.)
0560,7,Time,35,Telling the Time,9,stop watch,stop watch,碼錶,n.[C],The coach uses a stop watch to record the runner's time.,source_771,source_771,,PDF text layer,9 stop watch (n.)
0561,7,Time,35,Telling the Time,10,watch,watch,手錶,n.[C],Do you like the watch your father gave you?,source_771,source_771,duplicate_word,PDF text layer,watch (n.) o
0562,7,Time,35,Telling the Time,11,electric,electric,電子,a.,We just bought a new electric stove.,source_771,source_771,,PDF text layer,'12 electric (a.)
0563,7,Time,35,Telling the Time,12,set,set,設定,v.,Can you please set the alarm clock for five o'clock? R,source_771,source_771,,PDF text layer,set (v.)
0564,7,Time,35,Telling the Time,13,turn on,turn on,打開；啟動,,emember to turn on your alarm clock.,source_771,source_771,,PDF text layer,e 14 turn on (phr.)
0565,7,Time,35,Telling the Time,14,turn off,turn off,關掉；關閉,,Turn off the alarm clock. It's very noisy.,source_771,source_771,,PDF text layer,e 15 turn off (phr.)
0566,7,Time,35,Telling the Time,15,go off,go off,響起；離開；爆炸,,This lesson uses the word go off in the unit Telling the Time.,source_771,generated_example,,PDF text layer,16 go off (phr.)
0567,8,Money,36,Different Types of Money,1,money,money,錢,n.[U],Chap I don't have any money with me.,source_771,source_771,,PDF text layer,money (n.)o
0568,8,Money,36,Different Types of Money,2,cash,cash,現金,n.[U],Do you want to pay with cash or a credit card? withdraw cash提款 ; deposit cash存款,source_771,source_771,,PDF text layer,.2 cash (n.)o
0569,8,Money,36,Different Types of Money,3,check,check,檢查,v.,Please check and fix the broken water pipes.,source_771,source_771,duplicate_word,PDF text layer,check (n.) o
0570,8,Money,36,Different Types of Money,4,credit card,credit card,信用卡,n.[C],"My credit card was stolen, so I need to call my bank.",source_771,source_771,,PDF text layer,• 4 credit card (n.) 0
0571,8,Money,36,Different Types of Money,5,dollar,dollar,元,n.[C],Jeffrey spent a million dollars buying his new house.,source_771,source_771,,PDF text layer,dollar (n.) o
0572,8,Money,36,Different Types of Money,6,pound,pound,英鎊,n.[C],I have 10 pounds. Euro歐元 ; yen日圓,source_771,source_771,duplicate_word,PDF text layer,pound (n.) O
0573,8,Money,36,Different Types of Money,7,cent,cent,分,n.[C],I paid a dollar and 50 cents for this book.,source_771,source_771,,PDF text layer,cent (n.) o
0574,8,Money,36,Different Types of Money,8,bill,bill,鈔票,n.[C],"I don't have a dollar bill, only coins.",source_771,source_771,,PDF text layer,• 8 bill (n.) O
0575,8,Money,36,Different Types of Money,9,coin,coin,硬幣,n.[C],"Coins are heavy, so I try to spend them quickly.",source_771,source_771,,PDF text layer,e 9 coin (n.) O
0576,8,Money,36,Different Types of Money,10,change,change,零錢,n.[U],Keep the change! 不用找零了,source_771,source_771,duplicate_word,PDF text layer,change (n.) O
0577,8,Money,36,Different Types of Money,11,borrow,borrow,借,v.,Jenny borrowed 100 dollars from Lisa.,source_771,source_771,,PDF text layer,borrow (v.)
0578,8,Money,36,Different Types of Money,12,end,end,結束,,This lesson uses the word end in the unit Different Types of Money.,machine_translation,generated_example,duplicate_word,PDF text layer,lend (v.)
0579,8,Money,36,Different Types of Money,13,note,note,紙鈔,n.[C],These notes (banknotes) do not look real.,source_771,source_771,duplicate_word,PDF text layer,note (n.) O
0580,8,Money,36,Different Types of Money,14,return,return,還,v.,I found a wallet and returned it to its owner.,source_771,source_771,,PDF text layer,'14 return (v.)
0581,8,Money,36,Different Types of Money,15,Chap,Chap,章,,This lesson uses the word Chap in the unit Different Types of Money.,machine_translation,generated_example,,PDF text layer,Chap
0582,8,Money,37,Buying and Selling,1,fee,fee,費,n.[C],There is a 20 dollar fee for new customers.,source_771,source_771,,PDF text layer,e 2 fee (n.) o
0583,8,Money,37,Buying and Selling,2,customer,customer,顧客,n.[C],This lesson uses the word customer in the unit Buying and Selling.,source_771,generated_example,,PDF text layer,e 3 customer (n.) O
0584,8,Money,37,Buying and Selling,3,tip,tip,小費,n.[C],"When you're in America, don't forget to give your waiter a tip.",source_771,source_771,,PDF text layer,tip (n.) C)
0585,8,Money,37,Buying and Selling,4,buy,buy,買,v.,Vicky wants to buy a new skirt.,source_771,source_771,,PDF text layer,buy (v.)
0586,8,Money,37,Buying and Selling,5,cancel,cancel,取消,v.,"If I cancel my order, will I still be charged?",source_771,source_771,,PDF text layer,'6 cancel (v.)
0587,8,Money,37,Buying and Selling,6,charge,charge,收費,v.,This lesson uses the word charge in the unit Buying and Selling.,source_771,generated_example,,PDF text layer,e 7 charge (v.)
0588,8,Money,37,Buying and Selling,7,cost,cost,花費,v.,"This sweater cost me 1,000 NT dollars. cost an arm and a leg 索價不菲",source_771,source_771,,PDF text layer,cost
0589,8,Money,37,Buying and Selling,8,spend,spend,花費；度過,v.,I spend one hour reading every night.,source_771,curated_example,,PDF text layer,spend (v.)
0590,8,Money,37,Buying and Selling,9,pay,pay,付錢,v.,Do you want me to pay you now?,source_771,source_771,,PDF text layer,pay (v.)
0591,8,Money,37,Buying and Selling,10,cheap,cheap,便宜的,a.,"This ring is beautiful, and it’s quite cheap.",source_771,source_771,,PDF text layer,cheap (a.)
0592,8,Money,37,Buying and Selling,11,expensive,expensive,貴的,a.,The watch is too expensive for me.,source_771,source_771,,PDF text layer,expensive (a.)
0593,8,Money,37,Buying and Selling,12,free,free,免費的,a.,I got a free cup of coffee.,source_771,source_771,,PDF text layer,free [fri] (a.)
0594,8,Money,37,Buying and Selling,13,treat,treat,請客,n.[C],You don't have to pay for dinner. It is my treat.,source_771,source_771,,PDF text layer,treat (n.) O
0595,8,Money,37,Buying and Selling,14,value,value,價值,n.[C] [U],What is the value of this old book? valuable 有價值的,source_771,source_771,,PDF text layer,'15 value (n.) 00
0596,8,Money,37,Buying and Selling,15,vendor,vendor,小販,n.[C],There are a lot of vendors at that night market.,source_771,source_771,,PDF text layer,016 vendor (n.) O
0597,8,Money,37,Buying and Selling,16,price,price,價位,n.[C],The price of this house is too high.,source_771,source_771,,PDF text layer,price (n.)o
0598,9,Food,38,Fruit,1,watermelon,watermelon,西瓜,n.[C],You shouldnlt swallow watermelon seeds. watermelon juice 西瓜汁,source_771,source_771,,PDF text layer,watermelon
0599,9,Food,38,Fruit,2,apple,apple,蘋果,n.[C],Bring an apple with you.,source_771,source_771,,PDF text layer,apple (n.) o
0600,9,Food,38,Fruit,3,strawberry,strawberry,草莓,n.[C],I ate a sweet strawberry after lunch.,source_771,curated_example,,PDF text layer,strawberry
0601,9,Food,38,Fruit,4,tomato,tomato,番茄,n.[C],I like red tomatoes.,source_771,source_771,,PDF text layer,tomato
0602,9,Food,38,Fruit,5,banana,banana,香蕉,n.[C],Bananas are Nick's favorite fruit.,source_771,source_771,,PDF text layer,banana
0603,9,Food,38,Fruit,6,grape,grape,葡萄,n.[C],Do you want grape juice or guava juice?,source_771,source_771,,PDF text layer,grape (n.) o
0604,9,Food,38,Fruit,7,guava,guava,芭樂,n.[C],I learned the word guava when we talked about food.,source_771,generated_example,,PDF text layer,guava (n.) o
0605,9,Food,38,Fruit,8,orange,orange,柳橙,n.[C],Father bought a box of oranges.,source_771,source_771,duplicate_word,PDF text layer,orange (n.) o
0606,9,Food,38,Fruit,9,papaya,papaya,木瓜,n.[C],Papaya milk is my favorite drink.,source_771,source_771,,PDF text layer,papaya (n.) o
0607,9,Food,38,Fruit,10,peach,peach,桃子,n.[C],Would you like some peaches?,source_771,source_771,,PDF text layer,peach (n.) O
0608,9,Food,38,Fruit,11,pear,pear,梨子,n.[C],Victoria doesn't like to eat pears.,source_771,source_771,,PDF text layer,*II pear (n.) O
0609,9,Food,38,Fruit,12,pineapple,pineapple,鳳梨,n.[C],Pineapples are difficult to hold.,source_771,source_771,,PDF text layer,'12 pineapple (n.) o
0610,9,Food,38,Fruit,13,tangerine,tangerine,橘子,n.[C],"Some people think tangerines are too sour, but I like them.",source_771,source_771,,PDF text layer,'13 tangerine (n.) O
0611,9,Food,38,Fruit,14,fruit,fruit,水果,n.[C] [U],Fannie eats a lot of fruit every day.,source_771,source_771,,PDF text layer,I fruit (n.)OO
0612,9,Food,38,Fruit,15,emon,emon,右衛門,,I learned the word emon when we talked about food.,machine_translation,generated_example,,PDF text layer,lemon (n.) o
0613,9,Food,38,Fruit,16,mango,mango,芒果,n.[C],Mangoes are very sweet.,source_771,source_771,,PDF text layer,'16 mango (n.) O
0614,9,Food,38,Fruit,17,nut,nut,堅果,n.[C],A lot of children cannot eat nuts. go nuts氣得發瘋,source_771,source_771,,PDF text layer,'17 nut (n.) O
0615,9,Food,38,Fruit,18,watermelon juice,watermelon juice,西瓜汁,,I learned the word watermelon juice when we talked about food.,machine_translation,generated_example,,PDF text layer,watermelon juice
0616,9,Food,39,Vegetables,1,vegetable,vegetable,蔬菜,n.[C],Eating enough vegetables can keep us healthy. Vegetarian素食者 ; vegetable soup 蔬菜湯,source_771,source_771,,PDF text layer,vegetable (n.)o
0617,9,Food,39,Vegetables,2,bean,bean,豆子,n.[C],There are many different beans in this soup.,source_771,source_771,,PDF text layer,bean (n.)o
0618,9,Food,39,Vegetables,3,cabbage,cabbage,高麗菜,n.[C],Mike makes delicious cabbage dumplings.,source_771,source_771,,PDF text layer,e 3 cabbage (n.) o
0619,9,Food,39,Vegetables,4,carrot,carrot,胡蘿蔔,n.[C],I am growing carrots in my garden.,source_771,source_771,,PDF text layer,e 4 carrot (n.) c
0620,9,Food,39,Vegetables,5,corn,corn,玉米,n.[C],Tony is eating corn on his pizza.,source_771,source_771,,PDF text layer,e 5 corn (n.) o
0621,9,Food,39,Vegetables,6,lettuce,lettuce,萵苣,n.[C][U],The lettuce in this salad is very fresh.,source_771,source_771,,PDF text layer,. 6 lettuce
0622,9,Food,39,Vegetables,7,onion,onion,洋蔥,n.[C],"When Mom cooks, the whole house smells like onions.",source_771,source_771,,PDF text layer,• 7 onion (n.)o
0623,9,Food,39,Vegetables,8,potato,potato,馬鈴薯,n.[C],Did you know that French fries are made from potatoes? couch potato 沙發馬鈴薯(愛窩在沙發上看電視的人);yam地瓜,source_771,source_771,,PDF text layer,8 potato (n.) C)
0624,9,Food,39,Vegetables,9,pumpkin,pumpkin,南瓜,n.[C],Pumpkins are very popular at Halloween. pumpkin pie南瓜派,source_771,source_771,,PDF text layer,pumpkin (n.)o
0625,9,Food,39,Vegetables,10,necessary,necessary,必要的,a.,It is necessary for us to eat vegetables. unnecessary 不必要的,source_771,source_771,,PDF text layer,'10 necessary (a.)
0626,9,Food,39,Vegetables,11,helpful,helpful,有益的,a.,Eating vegetables is helpful to our bodies.,source_771,source_771,,PDF text layer,helpful (a.)
0627,9,Food,39,Vegetables,12,fresh,fresh,新鮮的,a.,Mother buys fresh vegetables every day.,source_771,source_771,,PDF text layer,fresh (a.)
0628,9,Food,39,Vegetables,13,include,include,包含,v.,"Green vegetables include lettuce, beans, and cabbages.",source_771,source_771,duplicate_word,PDF text layer,'13 include (v.)
0629,9,Food,39,Vegetables,14,vegetarian,vegetarian,素食主義者,,I learned the word vegetarian when we talked about food.,machine_translation,generated_example,,PDF text layer,vegetarian
0630,9,Food,40,Meat and Eggs,1,build strong bones,build strong bones,強健骨骼,,I learned the word build strong bones when we talked about food.,machine_translation,generated_example,,PDF text layer,build strong bones
0631,9,Food,40,Meat and Eggs,2,chicken,chicken,雞肉,n.[U],Do you want to have chicken or beef?,source_771,source_771,duplicate_word,PDF text layer,chicken (n.) O
0632,9,Food,40,Meat and Eggs,3,pork,pork,豬肉,n.[U],I don't eat pork.,source_771,source_771,,PDF text layer,4 pork (n.) O
0633,9,Food,40,Meat and Eggs,4,fish,fish,魚,n.[U],The fish is really delicious! golden fish 金魚; fish/fishes 複數形,source_771,source_771,duplicate_word,PDF text layer,fish (n.) O
0634,9,Food,40,Meat and Eggs,5,shrimp,shrimp,蝦子,n.[U],How many shrimp did you eat? shrimp/shrimps 複數形,source_771,source_771,,PDF text layer,e 7 shrimp (n.) o
0635,9,Food,40,Meat and Eggs,6,egg,egg,蛋,n.[C],I need two eggs for this cake.,source_771,source_771,,PDF text layer,egg (n.) o
0636,9,Food,40,Meat and Eggs,7,steak,steak,牛排,n. [C] [U],I need two eggs for this cake. 0 Would you like to have steak for dinner?,source_771,source_771,,PDF text layer,steak
0637,9,Food,40,Meat and Eggs,8,turkey,turkey,火雞,n.[U],Americans eat turkey for Thanksgiving dinner.,source_771,source_771,duplicate_word,PDF text layer,turkey (n.) O
0638,9,Food,40,Meat and Eggs,9,II crab,II crab,二、螃蟹,,I learned the word II crab when we talked about food.,machine_translation,generated_example,,PDF text layer,'II crab
0639,9,Food,40,Meat and Eggs,10,duck,duck,鴨肉,n.[U],We will eat duck for lunch.,source_771,source_771,,PDF text layer,duck
0640,9,Food,40,Meat and Eggs,11,goose,goose,鵝肉,n.[U],Have you ever eaten goose?,source_771,source_771,duplicate_word,PDF text layer,goose
0641,9,Food,40,Meat and Eggs,12,Iamb,Iamb,羊肉,n.[U],This Iamb is very soft.,source_771,source_771,,PDF text layer,'14 Iamb (n.) O
0642,9,Food,40,Meat and Eggs,13,bone,bone,骨頭,n.[C],You have to eat the meat off the bone. The basketball player broke a bone in the basketball game.,source_771,source_771,,PDF text layer,'15 bone
0643,9,Food,40,Meat and Eggs,14,meat,meat,肉,n.[C][U],Do you eat meat?,source_771,source_771,,PDF text layer,1 meat (n.) 00
0644,9,Food,40,Meat and Eggs,15,beef,beef,牛肉,n.[U],Paul likes beef.,source_771,source_771,,PDF text layer,2 beef (n.) O
0645,9,Food,40,Meat and Eggs,16,meat and eggs,meat and eggs,肉和蛋,,I learned the word meat and eggs when we talked about food.,machine_translation,generated_example,,PDF text layer,meat and eggs
0646,9,Food,40,Meat and Eggs,17,white meat,white meat,白肉,,I learned the word white meat when we talked about food.,machine_translation,generated_example,,PDF text layer,white meat
0647,9,Food,41,Western Food vs. Chinese Food,1,meal,meal,餐,n.[C],We usually have three meals a day.,source_771,source_771,,PDF text layer,1 meal (n.)O
0648,9,Food,41,Western Food vs. Chinese Food,2,breakfast,breakfast,早餐,n.[C][U],What did you have for breakfast?,source_771,source_771,,PDF text layer,breakfast
0649,9,Food,41,Western Food vs. Chinese Food,3,oo,oo,哦,,I learned the word oo when we talked about food.,machine_translation,generated_example,duplicate_word,PDF text layer,oo
0650,9,Food,41,Western Food vs. Chinese Food,4,brunch,brunch,早午餐,n.[C],I learned the word brunch when we talked about food.,source_771,generated_example,,PDF text layer,'4 brunch (n.) O
0651,9,Food,41,Western Food vs. Chinese Food,5,dinner,dinner,晚餐,n.[C][U],Stephanie is helping her mother prepare dinner.,source_771,source_771,,PDF text layer,dinner (n.) 00
0652,9,Food,41,Western Food vs. Chinese Food,6,spaghetti,spaghetti,義大利麵,n.[U],Can we have spaghetti for supper?,source_771,source_771,,PDF text layer,e 7 spaghetti (n.) O
0653,9,Food,41,Western Food vs. Chinese Food,7,supper,supper,晚餐,n.[C][U],I learned the word supper when we talked about food.,source_771,generated_example,,PDF text layer,'8 supper (n.) 00
0654,9,Food,41,Western Food vs. Chinese Food,8,flour,flour,麵粉,n.[[U],The man used a lot of flour to bake the buns.,source_771,source_771,,PDF text layer,e 9 flour (n.) o
0655,9,Food,41,Western Food vs. Chinese Food,9,bun,bun,小圓麵包,n.[C],I learned the word bun when we talked about food.,source_771,generated_example,,PDF text layer,bun
0656,9,Food,41,Western Food vs. Chinese Food,10,bread,bread,麵包,n.[U],Please give us some more bread.,source_771,source_771,,PDF text layer,bread (n.) D
0657,9,Food,41,Western Food vs. Chinese Food,11,toast,toast,吐司,n.[U],I want butter on my toast. Toaster烤吐司機,source_771,source_771,,PDF text layer,toast
0658,9,Food,41,Western Food vs. Chinese Food,12,cereal,cereal,穀麥片,n.[U],Kevin eats cereal for breakfast every day.,source_771,source_771,,PDF text layer,'13 cereal (n.) O
0659,9,Food,41,Western Food vs. Chinese Food,13,ham,ham,火腿,n.[U],I put ham in my sandwich.,source_771,source_771,,PDF text layer,ham (n.) O
0660,9,Food,41,Western Food vs. Chinese Food,14,sandwich,sandwich,三明治,n.[C],Do you like sandwiches?,source_771,source_771,,PDF text layer,sandwich (n.) O
0661,9,Food,41,Western Food vs. Chinese Food,15,pizza,pizza,披薩,n.[C][U],Paul and I had two pizzas. a slice of pizza 一片披薩,source_771,source_771,,PDF text layer,pizza
0662,9,Food,41,Western Food vs. Chinese Food,16,rice,rice,米飯,n.[U],Steve always has rice for dinner.,source_771,source_771,,PDF text layer,rice [rms] (n.) O
0663,9,Food,41,Western Food vs. Chinese Food,17,tofu,tofu,豆腐,n.[U],"I don't eat meat, so I will order the tofu dumplings. tofu pudding 豆花; rice dumpling粽子 fried dumpling鍋貼、煎餃",source_771,source_771,,PDF text layer,'19 tofu
0664,9,Food,41,Western Food vs. Chinese Food,18,dumpling,dumpling,水餃,n.[C],I learned the word dumpling when we talked about food.,source_771,generated_example,,PDF text layer,'20 dumpling (n.) O
0665,9,Food,42,Eating at a Western Restaurant,1,salad,salad,沙拉,n.[C][U],Let us have some salad first.,source_771,source_771,,PDF text layer,salad
0666,9,Food,42,Eating at a Western Restaurant,2,OO,OO,哦,,I learned the word OO when we talked about food.,machine_translation,generated_example,duplicate_word,PDF text layer,OO
0667,9,Food,42,Eating at a Western Restaurant,3,drink,drink,飲料,v.n. [C],Do you want a drink?,source_771,source_771,,PDF text layer,drink
0668,9,Food,42,Eating at a Western Restaurant,4,water,water,水,n. [U],"May I have a glass of water, please?",source_771,source_771,,PDF text layer,* 5 water (n.) D
0669,9,Food,42,Eating at a Western Restaurant,5,milk,milk,牛奶,n. [U],I learned the word milk when we talked about food.,source_771,generated_example,,PDF text layer,milk
0670,9,Food,42,Eating at a Western Restaurant,6,coffee,coffee,咖啡,n. [U],Helen wants a cup of coffee.,source_771,source_771,,PDF text layer,8 coffee (n.) O
0671,9,Food,42,Eating at a Western Restaurant,7,tea,tea,茶,n. [U],I learned the word tea when we talked about food.,source_771,generated_example,,PDF text layer,tea (n.) O
0672,9,Food,42,Eating at a Western Restaurant,8,beer,beer,啤酒,n. [U],Those men are drinking a lot of beer.,source_771,source_771,,PDF text layer,'10 beer (n.) O
0673,9,Food,42,Eating at a Western Restaurant,9,ice,ice,冰,n. [U],There is some ice water in the refrigerator.,source_771,source_771,,PDF text layer,ice (n.) o
0674,9,Food,42,Eating at a Western Restaurant,10,dessert,dessert,甜點,n. [C][U],You can choose either cake or pie for dessert.,source_771,source_771,,PDF text layer,'12 dessert (n.) 00
0675,9,Food,42,Eating at a Western Restaurant,11,cake,cake,蛋糕,n. [U],I learned the word cake when we talked about food.,source_771,generated_example,,PDF text layer,cake (n.) OO
0676,9,Food,42,Eating at a Western Restaurant,12,cheese,cheese,起司,n. [U],Would you like some cheese with your bread?,source_771,source_771,,PDF text layer,cheese (n.) O
0677,9,Food,42,Eating at a Western Restaurant,13,chocolate,chocolate,巧克力,n. [C][U],Danny bought me a box of chocolates.,source_771,source_771,,PDF text layer,chocolate (n.)
0678,9,Food,42,Eating at a Western Restaurant,14,menu,menu,菜單,n. [C],Look at the menu and tell me when you're ready to order. May I take your order?,source_771,source_771,,PDF text layer,menu (n.) O
0679,9,Food,42,Eating at a Western Restaurant,15,order,order,訂,v.n. [C],I learned the word order when we talked about food.,source_771,generated_example,duplicate_word,PDF text layer,order (v.) (n.) o
0680,9,Food,42,Eating at a Western Restaurant,16,main,main,主要的,a.,Tonight's main course is steak.,source_771,source_771,,PDF text layer,main (a.)
0681,9,Food,42,Eating at a Western Restaurant,17,soup,soup,湯,n. [U],Can I have some more soup?,source_771,source_771,,PDF text layer,2 soup (n.)O
0682,9,Food,43,Fast Food and Snacks,1,hamburger,hamburger,漢堡,,I learned the word hamburger when we talked about food.,machine_translation,generated_example,,PDF text layer,hamburger
0683,9,Food,43,Fast Food and Snacks,2,fries,fries,薯條,,I learned the word fries when we talked about food.,machine_translation,generated_example,,PDF text layer,fries
0684,9,Food,43,Fast Food and Snacks,3,ketchup,ketchup,番茄醬,n.[U],Do you want any ketchup for your fries?,source_771,source_771,,PDF text layer,'4 ketchup (n.) O
0685,9,Food,43,Fast Food and Snacks,4,hot dog,hot dog,熱狗,n.[C],Billy wants to have a hot dog.,source_771,source_771,,PDF text layer,* 5 hot dog (n.) o
0686,9,Food,43,Fast Food and Snacks,5,soda,soda,汽水,n.[C][U],I learned the word soda when we talked about food.,source_771,generated_example,,PDF text layer,e 6 soda (n.) 00
0687,9,Food,43,Fast Food and Snacks,6,cola,cola,可樂,n.[C][U],Cola is my brother's favorite drink.,source_771,source_771,,PDF text layer,cola (n.) OO
0688,9,Food,43,Fast Food and Snacks,7,liquid,liquid,液體,n.[U],Water is liquid. solid 固體的,source_771,source_771,,PDF text layer,e 8 liquid (n.) O
0689,9,Food,43,Fast Food and Snacks,8,snack,snack,點心,n.[C],Would you like to have a snack? ? sweets 甜食,source_771,source_771,,PDF text layer,snack (n.) O
0690,9,Food,43,Fast Food and Snacks,9,candy,candy,糖果,n.[C][U],Don't eat too much candy!,source_771,source_771,,PDF text layer,candy (n.) 00
0691,9,Food,43,Fast Food and Snacks,10,cookie,cookie,餅乾,n.[C],Please help yourself to the cookies.,source_771,source_771,,PDF text layer,cookie
0692,9,Food,43,Fast Food and Snacks,11,doughnut,doughnut,甜甜圈,n.[C],That bakery sells delicious colorful doughnuts.,source_771,source_771,,PDF text layer,'12 doughnut (n.) O
0693,9,Food,43,Fast Food and Snacks,12,pie,pie,派,n.[C],Betty knows how to make an apple pie.,source_771,source_771,,PDF text layer,pie
0694,9,Food,43,Fast Food and Snacks,13,popcorn,popcorn,爆米花,n.[U],Let's get some popcorn!,source_771,source_771,,PDF text layer,popcorn (n.) O
